headline,label3
"New documents show Trump kept 2 sets of books for his biggest property in Manhattan, pointing to potential financial fraud",0.0
China's stance on North Korea?,1.0
"William Barr says he 'did not think the republic was in genuine danger' on January 6, but believes Trump became 'manic and unreasonable' post-election",0.0
Norwegians are being lured to the north,1.0
"An escalation of the conflict in the Donbass, an overview",0.0
"Growing Calls to 'Audit the Ultra-Rich' as Yellen Says Tax Dodging Could Cost US $7 Trillion Over 10 Years | ""Imagine what we could do for people with $7 trillion. That's infrastructure, child care, paid leave, free college, climate action, and other investments in our communities.""",1.0
There’s No Containment Strategy for Climate Change,0.0
"Opinion: With Justice Ginsburg’s death, Mitch McConnell’s nauseating hypocrisy comes into full focus",0.0
Theory About U.S.-Funded Bioweapons Labs in Ukraine Is Unfounded,1.0
Biden's $1.5T budget bill boosts funding for congressional offices by 21%,1.0
Kavanaugh is confirmed to the Supreme Court by Senate -- live updates,1.0
Calling 911 with a false claim because of race can now put you in prison for years in N.J.,0.0
"What’s the likelihood of Russia annexing Belarus/Implementing the Union State, and how soon would they do it?",1.0
The Taliban Add to Afghan Crime Wave,0.0
Erdogan: Turkey may suspend ties with UAE over Israel deal,0.0
"Police found a pickup truck full of bombs and guns near Capitol, feds say",1.0
Trump threatens to economically devastate Turkey if it attacks kurds,0.0
"Supreme Court rejects GOP efforts to block new congressional maps in North Carolina, Pennsylvania",0.0
"Senate made criminal referral of Trump Jr., Bannon, Kushner and two others to federal prosecutors",0.0
Why is Turkey joining the EU against the interests of France and Germany?,1.0
"Texas judge interrupts jury, says God told him defendant is not guilty",1.0
"Dennis Ross: “In the Middle East, conspiracy is like oxygen and everyone breathes it. Both Israel and Saudi Arabia have a huge stake in Jordan’s stability. Conspiratorial rumors may be titillating but don’t reflect reality. Israeli/ Saudi leaders would not authorize anything against the King.”",1.0
"Vermont becomes first state to reach 80% vaccination; Gov. Scott says, ""There are no longer any state Covid-19 restrictions. None.""",0.0
"Florida Republicans revive deadly ""queers recruit"" myth with passage of ""don't say gay"" bill",1.0
Lithuania fears Lukashenko will sign away Belarus independence to Russia,0.0
"AOC says people who think raising minimum wage is a ‘crazy, socialist agenda' are living in a 'dystopian capitalist nightmare'",1.0
Warren offers bill to create wealth tax on net worth above $50 million,1.0
She needed life-saving surgery. A hospital gave her Panadol through a grate and sent her away,1.0
"NYPD Officer Luis Alvarez, 9/11 First Responder Who Testified Before Congress With Jon Stewart, Dies",1.0
Romney blames Trump for Georgia defeat: ‘He has disgraced the office of presidency’,0.0
Russia's Soft Takeover Of Belarus Completes Anti-NATO Military Buffer,1.0
U.S. delays ICBM test-launch in bid to de-escalate Russia nuclear tensions,0.0
Mike Pence ‘has told Trump he cannot overturn election result’,1.0
Why ASEAN’s rebuke of Myanmar’s top general matters,1.0
U.S. Warns Europe That Russian Troops May Plan Ukraine Invasion,0.0
It’s impeachable. It’s likely illegal. It’s a coup.,0.0
China hosts Russia troops to hold strategic military drills for first time,1.0
US ‘doomsday plane’ made four-hour flight following Putin’s nuclear weapons threat,0.0
"The United States Innovation and Competition Act of 2021, which just passed the senate two days ago and will almost certainly pass the house, has some sanctions on china and a few other important foreign policy positions sort of snuck into the middle.",1.0
REPORT: Kenosha man charged with illegally buying gun for Kyle Rittenhouse,0.0
"""Little evidence"" Keystone Pipeline would level prices despite GOP claims",1.0
European arms export,1.0
Shouldn’t Ted Cruz Be in Quarantine Right Now?,1.0
33 missing children rescued in Los Angeles trafficking operation,1.0
"What does the future hold for Australia amidst an aggressive China, & rising ASEAN & India?",0.0
Louisiana Senate Candidate Literally Torches a Confederate Flag in New Campaign Ad,1.0
"Russia may absorb Belarus: ""We’re ready to unite,"" Lukashenko says, in a 180 degree turn.",1.0
Minnesota Officials Link Arrested Looters to White Supremacist Groups,0.0
More Ukrainians fleeing Russian invasion denied entry at US-Mexico border,0.0
"One arrested with weapon at Joint Base Andrews after VP Harris' arrival, another at large",0.0
US to deploy thousands of additional troops to Middle East following Soleimani killing,0.0
The Age of America First: Washington’s Flawed New Foreign Policy Consensus,1.0
Bronze statue of Ruth Bader Ginsburg to be unveiled in Brooklyn during Women's History Month,1.0
FBI investigating ‘Trump Train’ swarming of Biden bus on Texas interstate: report,1.0
"Jeffrey Epstein, accused sex trafficker, dies by suicide: Officials",0.0
"Russian commanders 'will be hunted down for war crimes', justice secretary warns",0.0
Hate crime charges filed against 4 in torture of teen,0.0
One million Americans have already cast 2020 vote in ‘historic’ early voting surge,1.0
Recreational marijuana becomes legal in Illinois on New Years Day,1.0
"Joseph Nye on the future of U.S.-China relations: ""The United States cannot contain China as we tried to contain the Soviet Union, but we can constrain its choices by shaping the environment in which it rises.""",1.0
[2021-10-09] Geopolitics Weekly Discussion Thread,1.0
Effect of China’s Belt and Road Initiative on the UN voting habits of member countries?,1.0
Russia says US submarine violated its waters in far east,0.0
"Goodbye, Bill Barr",1.0
Suspected Internet Cable Spy Ship Operating In Americas For Over A Month,0.0
"Poland’s Fraught Offer: Fighter Jets for Ukraine, but Only Through U.S. Hands",1.0
Missouri Bill Seeks to Make Abortions for Ectopic Pregnancies Illegal,0.0
Las Cruces officer heard saying 'I'm going to... choke you out' before suspect dies,0.0
"Ted Cruz visits ‘People’s Convoy’ protesters, rides shotgun in semi",0.0
DeSantis attacks Disney day after CEO speaks against 'Don't Say Gay',0.0
Watchdog finds DHS identified threats prior to January 6 but did not widely share intelligence until after attack,0.0
Actor Danny Trejo saves a trapped baby from an overturned car,0.0
"Some allowed to go home, others evacuated as wildfires grow",1.0
Amnesty International: U.S. police must end militarized response to protests,0.0
Boris Johnson urges Putin to step back from ‘edge of precipice’; Liz Truss to chair Ukraine Cobra meeting,1.0
Criminal charges expected this week against Epstein guards,0.0
"Trump Now Spitballing Ways to Launch More Russian War, Then “Sit Back and Watch”",0.0
Atlanta; Tribute to victims on anniversary of spa shootings,0.0
Why can’t Taiwan develop nuclear weapons or the U.S give it to them secretly? This would act as a deterrent against a Chinese invasion.,0.0
Texas Republicans call on county GOP chair to resign for saying Floyd's death was staged,0.0
The future of Belarus,1.0
Resurfacing this essay by President Elect Joe Biden: Why America Must Lead Again,1.0
Students close to getting voting power on WA education board,1.0
"Taliban takeover of Afghanistan will reshape Middle East, official warns. Persian Gulf states are having to reconsider their alliances and especially whether they can still trust the US, says senior source.",1.0
"Hackers steal $2.3m from Trump reelection fund, says GOP",0.0
U.S.-French Deal On New Aircraft Carriers Could Mend Rift From Sub Snub,0.0
Tennessee Republicans revolt against Trump's outsider pick for House seat,1.0
Iraqi pro-Iran militias plan siege of Baghdad Green Zone | Hammam Latif | AW,1.0
Democratic presidential nominee Biden tests negative for COVID-19,0.0
"Postal worker admits fabricating allegations of ballot tampering, officials say",1.0
Becoming Strong: The New Chinese Foreign Policy,1.0
Many Trucker Convoy Supporters Worried They’re Being Lured Into a Trap,0.0
Rabbi who backed Abramovich's citizenship banned from leaving Portugal,0.0
What are your opinions on the online website - The Diplomat?,1.0
"Now Ted Cruz may be buying his own books through a mystery company. If Cancún Ted is paying royalties to himself through a shadow entity, that could stir the FEC into action",1.0
'Pharma bro' Martin Shkreli sentenced to 7 years in prison,0.0
Tech writer suggests '10 Year Challenge' may be collecting data for facial recognition algorithm,1.0
Books on geopolitics of bangladesh,1.0
Why were Afghan Mujhahideens so vicious to one another after the Soviet withdrawal?,0.0
A political experiment in East Africa,1.0
"Immigration arrests in the US plunge under Biden administration, data show",0.0
"There is no ""Putin wing"" of the GOP: Why almost no Republican backs Ukraine over Russia",0.0
Russia confirms its military personnel are in Venezuela,1.0
"House approves ban on Russian oil to US, bolstering Biden",0.0
Giuliani sued for $1.3 billion by Dominion Voting systems over false election fraud claims,0.0
"FBI cannot even look at your phone lock screen without a warrant, rules judge",1.0
Energy industry swipes back at Psaki 'red herring' comment on oil and gas leases,1.0
"""They have broken my spirit"": Chair of Oregon Republican Party quits over ""wickedness"" within GOP The former chair accused his own party of being ''evil'' and using communist pyschological warfare tactics """,0.0
Why abandoning the Kurds is awful for international geopolitics and the U.S.,0.0
"The ""People's Convoy,"" like Trump's new social media platform, is another right-wing grift gone bust",1.0
Biden administration moves to cut smog-forming pollution from heavy trucks,0.0
The White House reportedly scrapped a national testing plan because the virus was mostly hitting blue states,1.0
"Jail video surveillance from Jeffrey Epstein's first suicide attempt in July is missing, prosecutor says, according to reports",0.0
French army says senior al Qaeda leader killed in Mali,0.0
Tour de France to sue fan who caused mass crash during stage 1,0.0
What are your go to academic journals for the geopolitics of energy?,1.0
Bernie Sanders Says It Is 'Nauseating' to See Corporations Praise Frontline Workers as 'Heroes' While Refusing to Pay Them More,1.0
"George W. Bush won't support Donald Trump’s reelection, report says",0.0
"US seeks formal alliance similar to Nato with India, Japan and Austrailia",1.0
Donald Trump Jr tests positive for coronavirus,1.0
In guise of airlifting diplomats: Indian military planes drop weapons in Afghanistan.,0.0
Andrew Yang overtakes Pete Buttigieg to become fourth most favored primary candidate: Poll,1.0
The Rise of White Nationalist Hispanics,1.0
AOC says coronavirus bailout should ban stock buybacks — especially for airlines,0.0
What effect would succesful and plentiful fusion energy bring to the global geopolitics?,1.0
"Chechen general Magomed Tushayev, the president’s right-hand man, killed near Kiev",0.0
Missouri lawmaker seeks to prohibit residents from obtaining abortions out of state,1.0
Michigan Republican tells daughters to ‘lie back and enjoy it’ if rape is inevitable,0.0
"Naomi Osaka withdrew from the French Open on Monday, according to her social media, one day after tennis’ Grand Slams threatened disqualification or suspension if she continued to skip press conferences",1.0
O’Rourke calls Abbott a “thug” and an “authoritarian” who’s “got his own oligarch here in the state of Texas”,1.0
What would Russia do if it was locked out of the swift system?,1.0
Doug Jones Projected to win Alabama Senate,1.0
"Satellite images reveal China's aircraft carrier 'factory,' analysts say",1.0
Dr. Fauci says his daughters need security as family continues to get death threats,0.0
Barr suggests he would still vote for Trump,1.0
Elizabeth Warren will drop out of the 2020 presidential race after disappointing Super Tuesday showing,0.0
French Intelligence Agency Braces for Russian Bots to Back Le Pen,1.0
Georgia state Senate passes bill targeting 'divisive concepts' in schools,1.0
Texas Man Convicted in First Jan. 6 Trial,1.0
"The Chinese are now buying as much stuff as Americans, a game-changer for the world economy",1.0
Facebook and Instagram ban Trump 'indefinitely',0.0
"Iran’s Top Nuclear Scientist Killed in Attack, State Media Say",0.0
Question: What benefit does the USA get from its nearly globe spanning hegemony?,1.0
"Bernie Sanders says he's staying in race, looks forward to debating Joe Biden",1.0
Treasury Secretary Janet Yellen says Americans will likely see another year of ‘very uncomfortably high’ inflation,0.0
"U.S. Congress reaches agreement for Ukraine aid, government funding bill",1.0
The walls are going up across Europe,1.0
"Erdogan raises rhetoric in Greece standoff in Mediterranean - Deploys tanks near Greek border and calls for ""[tearing] up the immoral maps and documents imposed""",0.0
"Trump Ordered Mueller Fired, but Backed Off When White House Counsel Threatened to Quit",0.0
"How kidnappers, zealots and rebels are making Nigeria ungovernable",0.0
Megathread 6: War in Ukraine,0.0
Ukraine Airbnbs being booked in effort to get money to residents,1.0
The Gorilla Foundation is sad to announce the passing of our beloved Koko,1.0
Ukraine raises stakes for Trump's 'America First' agenda,1.0
"9 Democrats, 9 Republicans Introduce Legislation to Reduce Polarization and Support Community Bridgebuilding",1.0
White House turns down offers from CDC to help with contact tracing,1.0
"""General Mud"" Putin's biggest enemy and Ukraine's only ally",0.0
Senate passes anti-lynching bill and sends federal hate-crimes legislation to Biden,1.0
Does violence tends to settle? Are we mexicans in the middle of a power war that will at some point be won by someone and thus will be less violence?,0.0
Colorado passes resolution to award electoral votes to whoever wins the popular vote,1.0
Serbia considers buying Chinese missiles despite US warning,1.0
Michigan GOP candidate says he tells daughters to ‘lie back and enjoy it’ if rape is inevitable,0.0
US Pres. Trump: Will take steps to sanction Hong Kong officials involved in eroding of autonomy,1.0
Ukraine may seek nuclear weapons if left out of NATO: Diplomat | Conflict News,0.0
Trump's 'Don't be afraid of COVID' tweet may be the most irresponsible one in history,0.0
"MyPillow CEO says Bed Bath & Beyond, Kohl's stopped selling his products, prompting calls for boycotts",0.0
Virginia parents concerned bill will lead to spike in student referral to police,1.0
"California's average gas price hits new record high with $5.28 a gallon, AAA says",1.0
Medical Marijuana passes VA Senate 40-0.,1.0
Emirates supports Macron after controversy over Muhammad cartoons and criticizes Turkey's opportunism,1.0
Israel Presses Ahead With Plan to Annex Parts of West Bank,1.0
Pharmaceutical giant 'plotted to destroy cancer drugs to drive prices up 4000%',0.0
Biden signs spending bill that includes $13.6 billion in Ukraine aid,1.0
U.S. Senate approves bill to pressure China over Uighur rights,1.0
Officer with knee to George Floyd's neck to be tried alone,0.0
Megathread: President Trump Suggests Delaying 2020 Presidential Election,1.0
"China to scrap limit on presidential term, meaning Xi can stay on",1.0
"Russia is helping China build a new missile attack warning system, Putin says",0.0
"""China Is National Security Threat No. 1"" -- US Director of National Intelligence John Ratcliffe",0.0
Bolivian soldier who killed Che Guevara dies at age 80,0.0
'Stop the count': Crowd tries to storm Detroit convention centre,0.0
Direct line to UK immigration set up for Ukrainians in Calais,1.0
Future of Central Asia? Will it become the next Middle East?,1.0
"Grant Imahara, 'Mythbusters' co-host, dead at 49",0.0
"I am Lt. Col. Jyri Raitasalo, Military Professor of War. Ask Me Anything About NATO Defense Preparedness.",0.0
Trump press secretary Kayleigh McEnany tests positive for coronavirus,1.0
"Robert Trump, the younger brother of President Donald Trump, dead at age 72",0.0
‘Defending freedom is going to cost’: Joe Biden warns Americans will pay for ban on Russian oil,0.0
Supreme Court Rejects Republicans on Congressional Voting Maps,1.0
Sen. Leahy: Putin has miscalculated the United States because “he was able to lead Donald Trump around like a puppy dog”,1.0
"Trump tax returns can be released to Congress, DOJ says",1.0
Young sex trafficking victims were allegedly trafficked again by staff at Government-Contracted Shelter in Texa,0.0
Kenosha County DA says Kyle Rittenhouse has violated bond,0.0
"Merchant Banker Took Money, Instructions From Moscow to Run New York ‘Propaganda Center’: DOJ",1.0
Biden's next executive order will let people stay on unemployment if they quit an unsafe job,0.0
Congress passes Emmett Till bill to make lynching a hate crime,0.0
Dems Just Got Huge Wins (For Now) On Gerrymandering,1.0
Report: Sen. Graham pressured Ga. secretary of state to throw out legally cast ballots,0.0
Lindsey Graham's Challenger Jaime Harrison Takes Narrow Lead in New Poll,1.0
US to send troops to Saudi Arabia,1.0
Superdelegate pushing convention effort to stop Sanders is health care lobbyist who backed McConnell,1.0
Right-wing group targets New York Times reporters who have aggressively reported on its spy tactics,0.0
DeSantis’s press secretary says anyone who opposes Florida’s “Don’t Say Gay” bill is a pedophile,1.0
"Why does America grant Chinese Internet Companies Market Access while All Major American Internet Companies are Denied Chinese Market Access, It's basically a 1 way Import ban?",0.0
Possible changes in geopolitical world order,1.0
"After suing Fox News for $1.6 billion, Dominion says it could file lawsuits against other media outlets and even Trump",0.0
Why is China cracking down its tech sector?,1.0
Is Iran Ready For Great Power Competition In The South Caucasus?,1.0
Democrat senators vow to legalise cannabis this year,1.0
NYT: China’s New Rules Could Hit U.S. Firms and Send a Message to Biden,1.0
Nursultan Nazarbayev steps down from presidency of Kazakhstan,1.0
Goldman Sachs is the 1st major Wall Street bank to pull out of Russia,1.0
EU creates defence and space branch 'to complement NATO',1.0
KKK denied permit to burn cross atop symbolic mountain in Georgia,0.0
Megathread: Pro-Trump protesters storm US Capitol during certification of Electoral College votes,0.0
"Conservative Icon George Will Urges Nov. Sweep: Vote Out Trump, All GOP Enablers",1.0
"Greece, France, Cyprus and Italy in joint East Med drills",1.0
Why was the Soviet Union considered a superpower but not modern-day China?,1.0
"75-year-old protester pushed by Buffalo police files lawsuit against city, mayor and officers",0.0
Not every war gets the same coverage as Russia's invasion — and that has consequences,1.0
Former Deputy Accused Of Raping 14-Year-Old Avoids Jail Time And Sex Offender Registry,0.0
Introduction to Lobster Politics,1.0
The Great Climate Migration Has Begun - What are your thoughts?,1.0
Alex Jones guilty in all four Sandy Hook defamation cases,0.0
Is geo-economics a subfield of geopolitics or is it a completely different field?,1.0
AOC calls for expulsion of any members of Congress involved in planning January 6 riot,0.0
Trump is reportedly 'very aware' he lost the election but is putting up a fight as 'theater',0.0
‘You’re high’: Internet reacts after Trump says COVID makes him feel 20 years younger — 'Donald J. Trump feels better today than in the year 2000 because he's high on so many drugs.',1.0
Ethiopia nears war as PM orders military into defiant region,0.0
Ivanka Trump used a personal email account to send hundreds of emails about government business last year,1.0
Macro and Micro Geopolitical Forces at Play w/Russo-Ukraine Conflict,1.0
Law Enforcement fires paint projectile at residents on porch during curfew,1.0
Twitter hides Trump tweet for 'glorifying violence',0.0
Odds of a strong Japan/SouthKorea/Taiwan/Australia alliance?,1.0
"Qassem Soleimani, Iran’s top military commander, killed by US strike",0.0
The man fighting for Ukraine in D.C.,0.0
Why are China and India not taking climate change seriously when they are some of the most vulnerable to sea level rise?,0.0
Senate Democrats 'deeply disappointed' in Biden administration's decision to keep Trump-era rule,0.0
It Should Terrify You That Senators Are Dumb Enough To Think No One Would Notice Them Dumping Their Stocks,0.0
India’s prime minister orders lockdown of country of 1.3 billion people for 21 days,1.0
"What would the E.U/Europe, US/NATO have to do for Russia to feel at ease and not threatened?",1.0
“Tax the Rich” Gains Momentum After Explosive Report on Billionaire Tax Dodging,1.0
"Matt Gaetz tweets ""defund the FBI"" then deletes it amid FBI probe",1.0
Environmental groups press California on electric car rules,1.0
"House Democrats draw the line: No bipartisan cooperation with Republicans who questioned the election — After the Jan. 6 riot, some Democrats say they simply can't work with anyone who voted against certifying the election.",0.0
"Spirit-Frontier merger could hurt airline competition, legislators say.",0.0
Twitter suspends Marjorie Taylor Greene's account for one week,1.0
"Prince Philip has died aged 99, Buckingham Palace announces",0.0
AOC Condemns 'Misogynistic' Republicans for Not Criticizing Trump's $70K Hairstyling Write-Off While Attacking Her $250 Haircut,0.0
I’m a cop with a trans daughter. Lawmakers want me to arrest the doctors who saved her life.,1.0
Judge rules Michigan stay-at-home order doesn’t infringe on constitutional rights,1.0
Dutch parliament: China's treatment of Uighurs is genocide,1.0
Ted Cruz mocked Alexandria Ocasio-Cortez at CPAC after the congresswoman raised millions for his Texan constituents,0.0
"Prison guards, but not mother, get counselling after baby dies in cell",0.0
"Whistleblower claims Mormon Church stockpiled $100 billion in charitable donations, dodged taxes",1.0
Texas regulators seek punishment for pro-Trump lawyer Sidney Powell,0.0
Russian-American charged with acting as illegal Russian agent in the US,0.0
The Coronavirus Is the Worst Intelligence Failure in U.S. History | It’s more glaring than Pearl Harbor and 9/11—and it’s all the fault of Donald Trump’s leadership.,0.0
White House briefs top Republicans – but not Democrats – on Russia bounty row,1.0
How has the BJP government in India affected its foreign policy and geopolitical affairs?,0.0
"Erdogan lost in foreign policy maze of his own making | As talk of early elections grows louder, Erdogan needs to steer Turkey out of its international isolation to bolster his weakened position at home",0.0
Russian navy conducts major maneuvers near Alaska,1.0
Woman to Receive Death Sentence,0.0
Turkey to send Russian S-400 experts home in goodwill gesture to U.S.,1.0
"Verizon VP jokes at planting a 'brainwashed' FCC chairman, Ajit Pai says 'awesome'",1.0
"The Pentagon is eyeing a 500-ship Navy, documents reveal",1.0
"India-China Border Dispute: Indian Defence Minister, Experts Explain Chinese Border Incursions",0.0
"As providers are accused of interfering with access to patient data, pressure builds on government to act",0.0
"Water dispute can trigger Pak-India war, says former US envoy Cameron Munter",0.0
Former Buffalo officer who stopped fellow cop's chokehold on suspect will get pension after winning lawsuit,0.0
Is the non-recognition of the Armenian Genocide a decisive factor in the termination of the negotiation process between Armenia and Turkey?,1.0
"In Minneapolis strike, teachers say kids aren't all right",0.0
"The even harsher sanctions Congress is pushing for Russia, briefly explained",0.0
Kamala Harris Challenges Bill Barr to Say–Under Oath–that Clearing of Lafayette Square Was Unrelated to Bible Photo Op,1.0
"US Secretary Pompeo just called his Russian counterpart and told him that US and regional countries ""will not stand idly by as Russia exacerbates tensions in Venezuela""",0.0
Does the pan-Arab cause has a future? And what you think of the future of Egypt in relation to this?,1.0
Tensions between president Rouhani and Iran's Revolutionary Guard spill into open,0.0
New Hampshire Decriminalizes Marijuana,1.0
"Mueller Subpoenas Trump Organization, Demanding Documents About Russia",0.0
Online influencer Jake Paul charged after Scottsdale looting,0.0
Washington state radio station won't air Trump briefings because of 'false or misleading information',0.0
"Anderson Cooper: Trump is an 'obese turtle on his back, flailing in the hot sun'",1.0
"The missing context of ""how financially important is Hong Kong to China?""",0.0
"So, Kevin McCarthy isn't going to do anything about Marjorie Taylor Greene then?",1.0
Comcast deleted net neutrality pledge the same day FCC announced repeal,1.0
"US allies Britain, France, Germany reject Trump administration's demand to restore UN sanctions on Iran",0.0
Defense: FBI knew Whitmer kidnap suspects were 'stoned' crazy talkers,0.0
DNC sends cookie cakes to GOP governors to celebrate American Rescue Plan anniversary,1.0
U.S. imposes restrictions on Ethiopia assistance over Tigray atrocities,0.0
Virginia governor makes Election Day a holiday and expands early voting,1.0
