headline,label3
Unpaid Kentucky coal miners have been blocking a train track for 3 weeks,0.0
New revelations about Herschel Walker show how Democrats could hold the Senate,1.0
Amazon referred to DOJ for potential criminal obstruction of Congress,0.0
Swedish navy returns to vast underground HQ amid Russia fears,0.0
Supreme Court strikes down Louisiana law that would have limited state to one abortion clinic,1.0
The fight over domestic COVID funding is holding back global vaccination,0.0
Twitter temporarily restricts Donald Trump Jr.'s account after he posts video claiming masks are unnecessary,0.0
Republicans Hit With Scathing Questions About Russia In Viral Ad,1.0
US Corporations Boost Profits With Crushing Price Hikes Blamed on Inflation,1.0
Trial next for 4 accused in Michigan governor kidnap plot,0.0
Angela Merkel urges EU to seize control of data from US tech titans,1.0
"Susan Collins has failed the people of Maine and this country. She has voted to confirm Trump’s judicial nominees, approve tax cuts for the rich, and has repeatedly chosen to put party before people. I am running to send her packing. I’m Betsy Sweet, and I am running for U.S. Senate in Maine. AMA.",1.0
$1 million bounty on Putin offered by Russian businessman,1.0
Former NC Congressman and White House Chief of Staff Mark Meadows facing accusations of voter fraud,0.0
Texas Supreme Court deals final blow to federal abortion law challenge,1.0
Turkey Steps Back From Confrontation at Greek Border - The country is winding down an aggressive two-week operation to move tens of thousands of migrants to its frontiers. But relations with Greece and Europe have suffered.,0.0
War crimes court prosecutor opens Ukraine investigation,0.0
Portland mayor demands removal of camouflage-clad agents detaining protesters,0.0
Yale strikes Sackler name from campus amid opioid outrage,0.0
Calls for U.S. to ban Russian oil gain momentum despite inflation concerns,0.0
Thousands of Amazon workers demand time off to vote,1.0
"China could be ready to mount a 'full-scale' invasion of Taiwan by 2025, island's defense minister says",1.0
"""As China Rises, Britain and Australia Need Closer Security Ties""",1.0
[2021-09-18] Geopolitics Weekly Discussion Thread,1.0
"New York Senate votes to repeal 50-A, making police disciplinary records public",1.0
The biggest question Twitter users have from the debate: Can we mute the mics next time? The president interrupted both the moderator and Biden at least 128 times.,0.0
"Warnock, Ossoff win in Georgia, handing Dems Senate control",1.0
California ‘shattering prior election returns’ with 6m ballots already cast,1.0
Trump’s letter to Erdogan,1.0
Florida Lawmakers Pass 'Don't Say Gay' Bill,1.0
"Trump Just Removed the IG Investigating Elaine Chao. Chao’s Husband, Mitch McConnell, Already Vetted the Replacement.",1.0
William Barr says Trump 'actively sabotaged' Republicans with 'spiteful conduct' in the 2021 Georgia runoffs,0.0
Treasury and IRS to delay tax season deadline by 90 days,0.0
Tennessee doctors who spread COVID-19 vaccine misinformation could lose their licenses,0.0
Christie Called a Hypocrite For Seeking COVID Treatment After Saying People Were 'Gonna Have To' Accept Deaths,1.0
The West's never ending quest to 'de-radicalise' dissent,1.0
How is Iran's Relationship with the Central Asian Stan Countries like?,1.0
"Pelosi, Maloney Joined by 173 House Democrats in Calling on Postmaster General to Reverse Assault on Postal Service",0.0
'We are too small to take retaliatory action': Malaysian PM on India's palm oil boycott,0.0
Specter of voter fraud stalls changes to Minnesota privacy program | Safe at Home was created to help victims of intimate partner violence and others shield their address from aggressors.,0.0
Fired cop says he did nothing wrong in Breonna Taylor raid,0.0
GOP Removes Page Praising Donald Trump's 'Historic' Peace Deal With Taliban,1.0
California police officers would have to be 25 or get bachelor’s degree under new proposal,1.0
Capitol rioter from Idaho gets 4 years for attacking police with pipe,0.0
"Adam Kinzinger reveals ""biggest regret"" over Donald Trump, Ukraine",0.0
ABC cancels Roseanne Barr's sitcom after her tweet about black Obama aide Valerie Jarrett,0.0
What is the most valuable piece of land in your country?,1.0
Idaho passes bill that would send loving parents of trans kids to prison for life,1.0
"Donald Trump tells supporters he has 'never lost an election', in his first rally since losing the US election",1.0
"One in five U.S. election workers may quit amid threats, politics",0.0
Russia’s Aggression Against Ukraine Is Backfiring,0.0
"EU imposes 'global' sanctions over human rights crimes, including China and Russia",0.0
How does saber rattling by the Chinese government play domestically?,1.0
50 Cent forgot he had a stash of Bitcoin now worth $8m,1.0
Trump announces 'surge' of federal officers to Chicago despite outrage over Portland crackdown,1.0
A Kentucky tattoo shop is offering to cover up hate and gang symbols for free,0.0
"Russian, Belarusian athletes banned from Winter Paralympic Games as IPC reverses ruling",0.0
"What would happen if the US defense budget was significantly reduced and troops were pulled back in Asia, Middle East, and Europe?",1.0
Alex Jones arrested for DWI in Travis County,0.0
"660 U.S. Place Names Include a Slur for Native Women. Change Is Coming. - The Interior Department is asking tribes for help finding new names for mountains, rivers and other landmarks that include the offensive term “squaw.”",0.0
Germany decides in principle to buy F-35 fighter jet - government source | Reuters,1.0
Do you ever check your neighbors' criminal background? How do you do it?,0.0
Putin Orders Massive Snap Military Drills in Russia's Southwest,1.0
Armenia and Azerbaijan agree a new cease fire:US,1.0
Deborah Lipstadt’s confirmation vote postponed again due to Senator objection,0.0
All new posts about Afghanistan go here (Mega-Thread),1.0
"Russia declares war on Ukraine, reports of shelling at port city",0.0
Is defending Taiwan the best option for the USA?,1.0
'They beat our a--es': Russian mercenaries talk about humiliating defeat by US in reportedly leaked audio,0.0
New York Democrat Ritchie Torres elected as the first openly gay Black member of Congress,1.0
RNC sues Jan 6. committee over subpoena of data from software vendor Salesforce,1.0
Michigan candidate says he tells daughters to ‘lie back and enjoy’ if rape is inevitable,0.0
Amazon engineer quits after he 'snapped' when the company fired workers who called for protections,0.0
"Ron Johnson, Ted Cruz to meet with trucker convoy Tuesday in DC",1.0
"Biden Wants to Rejoin Iran Nuclear Deal, but It Won’t Be Easy (NY Times)",1.0
The Kremlin used undercover operatives and criminal organizations to propel Catalan separatism(Spain),0.0
"Joseph Nye: ""Trump deserves credit for pushing back on China's abusive trade practices, but it would have been better if we worked with our allies to isolate China. Also, his trade deal has been costly for Americans without changing the trade imbalance or addressing technological issues.""",1.0
"Senate GOP Agenda Would Hike Taxes on Poorest 40% by Average of $1,000",0.0
A New Congressional Budget Office Study Shows That Medicare for All Would Save Hundreds of Billions of Dollars Annually,1.0
Rudy Giuliani admits Biden is president hours after being sued for $1.3 billion by voting machine company,1.0
"Heavy Lies the Crown: The Survival of Arab Monarchies, 10 Years After the Arab Spring",0.0
George W. Bush maxes out political donations to Trump impeachment supporters Liz Cheney and Lisa Murkowski,1.0
"Greene Bought Oil, Defense Stocks While Complaining About War Profiteers",0.0
Governor signs permitless concealed carry bill into law,1.0
Pence Should Invoke 25th Amendment to Remove Trump From Office Immediately,1.0
Congress Is Set to Make the Rich Richer—Again,1.0
"Florida’s Department of Health will recommend against coronavirus vaccination for “healthy children,” the state’s surgeon general said Monday, contradicting the guidance from the Centers for Disease Control and Prevention (CDC) and other experts.",1.0
"Strengthening Quad: Eye on China, India invites Australia to join Malabar drill",1.0
Ex-generals face sanctions after they warn of 'civil war' in France,0.0
"50,000 net neutrality complaints were excluded from FCC’s repeal docket",0.0
Johnson: GOP should be ready to repeal Obamacare if they take control in 2024,1.0
US military establishes communications line with Russia to avoid any incidents near Ukraine,0.0
Pence meets far-right Israelis on West Bank holy site tour,1.0
Harris slammed for laughing after question about Ukrainian refugees,1.0
U.S. bans Russian oil imports over Ukraine invasion,1.0
Armenia and Azerbaijan agreed to end the war,0.0
"After Inlander inquiry, Spokane GOP deactivates and condemns conspiracy-theory-laden ""SpokaneGOP"" Gab account",0.0
Supreme Court inches towards deciding whether state legislatures can draw congressional districts largely free of court oversight,1.0
"Missouri seeks to ban abortion for ectopic pregnancies, with a penalty of up to 30 years in prison",0.0
"GOP candidate denies antisemitism, won’t apologize for Facebook posts",0.0
"Texas governor to close mail-in ballot drop-off boxes, limiting one per county",1.0
Second attempt to evacuate Mariupol appears close to collapse,0.0
Democrats take aim at Iowa as they seek to change their nominating system,1.0
Jeff Bezos would pay more than $5bn a year under Warren’s ‘Ultra-Millionaire’ tax plan,0.0
"Ossoff, Warnock celebrate Georgia earmarks in spending bill ready for Biden’s signature",1.0
"How significant is Chinas population problem really? Is there any credibility to the claims that Chinas National Bureau of Statistics have inflated population numbers in its national censuses, what are the ramifications?",0.0
U.S. officials won't say whether they will comply with China order to close Chengdu consulate,1.0
Marjorie Taylor Greene Allegedly Violated Georgia Tax Law by Claiming Two Permanent Residences,0.0
How will climate change improve the situation of Russia and other cold countries?,1.0
"After having deployed 100,000 troops over 20 years in Afghanistan and an equally large number from decades in Bosnia and Kosovo, how do Germans today feel about their country's involvement in overseas conflict?",0.0
Senate candidate who smoked blunt in ad burns Confederate flag in latest spot,1.0
Bellingcat investigation reveals plot to arrest Wagner operatives in Ukraine by using fake job offers,0.0
Biden terminates national emergency declaration on the US-Mexico border which Trump used to pay for his wall,0.0
Vaccine diplomacy and recognition ?,1.0
John Kerry said Trump destroyed the US's credibility on climate change. Anthony Blinken is surely also having a tough time to convince world leaders that American FP is now very different. How do countries usually go about doing damage repair in FP?,0.0
"Family of Tyson employee in Iowa who died of COVID-19 sues company, alleging gross negligence",0.0
"Romney, once party standard-bearer, is now the lone GOP voice willing to stand up to Trump",1.0
Megathread: House Votes to Impeach President Donald J. Trump,1.0
Trump files emergency request with Supreme Court to stop release of his tax returns,0.0
China's yuan likely to become Asia's central currency: Kenneth Rogoff,1.0
"Trump must turn over financial documents to New York attorney general, judge rules",1.0
‘I should have gotten the damn vaccine’: Father of 5 dies of COVID at age 39,0.0
Taiwan calls on the international community to stand by Hong Kong,1.0
Utah Republicans brace for big turnout for Tuesday’s caucus meetings. Candidates and political groups are recruiting attendees ahead of Tuesday’s GOP caucus night.,1.0
U.N. Human Rights Council Overwhelmingly Supports China’s Crackdown On Hong Kong,1.0
Revisiting the Egypt-Sudan-Ethiopia situation post Sudanese-Coup,1.0
Kyle Rittenhouse says he used coronavirus stimulus check to buy AR-15 used in fatal shooting,0.0
Bernie Sanders says he would legalize marijuana on his first day as president,1.0
'Dangerous dynamic': Coronavirus threatens new 'Cold War' between US and China,0.0
"Police chief says he doesn't ""believe racism plays a role"" in NYPD, as protesters fill streets",1.0
GOP senators urge Biden to send Polish warplanes to Ukraine,1.0
"Mitsubishi pulls Hearthstone tournament sponsorship after ""Free Hong Kong"" gamer ban",0.0
"Biden's Education Department is waiting for a student-loan borrower's cancer treatment to progress before taking her to court over her $100,000 debt cancellation request",0.0
Protestors gather outside USPS Postmaster General's home amid voter suppression allegations,1.0
"Analysis-With an eye on China, Japan's ruling party makes unprecedented defence spending pledge",1.0
Editorial: Iowa Republicans take a victory lap as they inflict suffering with law restricting trans girls,0.0
The Real Root Causes of America’s Border Crisis And How Biden Can Address Them,0.0
"India and Pakistan should settle issues between themselves, US won't mediate: Biden administration",1.0
Biden declines Trump request to withhold White House records from Jan. 6 committee,1.0
Pressure mounts on India to call out China for Covid as it readies to take lead role at WHO.,0.0
McConnell: Trump 'provoked' crowd that stormed Capitol,1.0
Coronavirus: they’re only answering Xi Jinping’s call but are China’s ‘Wolf Warrior’ diplomats doing more harm than good?,0.0
More police K9s forced into retirement following legalization of recreational marijuana,0.0
ASIA RICE-Thai rates slip on weak baht; India's demand improves,0.0
COVID — and Donald Trump — broke our social contract,0.0
US VP Harris embraces call for war crimes probe of Russia,0.0
What is driving the frostiness between Australia and New Zealand?,1.0
Michael Cohen sentenced to 3 years in prison,0.0
"'The President Just Committed a Felony': Trump Tells NC Residents to Vote Twice, Openly Encouraging Voter Fraud",1.0
Texas AG Says Trump Would've 'Lost' State If It Hadn't Blocked Mail-in Ballots Applications Being Sent Out,1.0
Poland to give MiG-29 jets to US for expected donation to Ukraine | Ukraine,1.0
Trump announces 25 percent tariff on Chinese technology,1.0
Former Minneapolis City Council member looks to unseat U.S. Rep. Ilhan Omar,1.0
"Opinion: With Ukraine showdown, Vladimir Putin reveals goal | DW | 31.12.2021",1.0
China Is Building Entire Villages in Another Country’s Territory,1.0
Coast woman charged with animal cruelty after 30 dead dogs reportedly found on property,0.0
What If Russia Loses?: A Defeat for Moscow Won’t Be a Clear Victory for the West,0.0
Elizabeth Warren says the stock market has become a 'playground for the billionaires'. She's calling for a wealth tax to fix it.,1.0
U.S. dismisses Russian claims of biowarfare labs in Ukraine,1.0
Biden to announce Russian energy import ban,0.0
"'A Conspiracy to Steal the Election, Folks': Alarms Sound After Postal Worker Reports Removal of Sorting Machines. The removal of key equipment from Post Offices should be viewed as nothing less than ""sabotage,"" said one observer.",0.0
A Biden return to Obama’s cautious China policies would be a big mistake | The Strategist,0.0
Finnish Greens shift in favour of NATO,1.0
Trump Eyes a New Real-Estate Purchase: Greenland,1.0
Azerbaijani forces 'advance 3 km into Armenia',1.0
Texas’s Abortion Bounty Law Is Inspiring Republican Lawmakers Around the Country,1.0
Malaysia to cancel $20 billion China-backed rail project: minister,0.0
The Florida Department of Health Medical Director has been put on leave for encouraging his own staff to get vaccinated.,1.0
"The reign of the Ayatollahs in Iran could be at an end. What's likely, in your opinion to replace it?",1.0
Rockets fired into northern Israel from Lebanon amid fighting in Gaza,0.0
Exclusive: Georgia doctor who forcibly sterilized detained women has been identified,0.0
"Dear Colleague on Legislative Package to Ban Russian Oil, Further Sanction Russia",0.0
U.S. Intelligence Publicly Accuses Iran and Russia of Interfering in 2020 Election,1.0
"Biden Has Finally Won Arizona, Turning It Democratic For The First Time In Decades",1.0
Can Yemen exist as a unified state post-war? Here’s what different forces want,1.0
Russia Establishes Outpost as First Sign of Visible Aid to Armenia,1.0
Disney suspends political contributions in Florida as CEO apologizes for silence over ‘don’t say gay’ bill,1.0
"Google, Apple, Twitter Reveal Return to Office Policies",1.0
Biden Clinches Electoral College Win as California Certifies,1.0
Dallas police accused of smearing man killed by cop in his own apartment,0.0
Maine postal workers reassemble high-speed sorting machine,1.0
Denmark sides with Biden in submarine row,1.0
Kamala Harris Said Biden Administration Would Decriminalize Marijuana,1.0
Republicans cheer Russian oil ban and jeer Biden for rising gas prices,0.0
Judge Blocks Greg Abbott’s Anti-Trans ‘Child Abuse’ Directive,0.0
EU-China investment deal put on ice over sanctions,1.0
US House votes to warn China against meddling in Dalai Lama succession,1.0
U.N. says it has credible reports that China holds million Uighurs in secret camps,1.0
Texas Gov. Greg Abbott's Approval Plummets as 52 Percent Believe State Is on Wrong Track,1.0
Five lessons in the middle of the diplomatic storm between Spain and Morocco,1.0
Will India become a Superpower?,1.0
Kamala Harris heads to Poland amid fighter jet rift - BBC News,1.0
Act of war and sending arms,0.0
Ice Cream Machine Hackers Sue McDonald's for $900 Million,1.0
Biden Administration Considers Sending Ukraine Military Equipment Once Bound for Afghanistan,1.0
Likelihood of a Moroccan-Algerian war?,0.0
"White supremacists on par with ISIS as ‘top threat,’ FBI director tells Senate",0.0
"Biden Urges Americans to Blame Rising Prices on Putin. Many Do, for Now.",0.0
Bank of Canada hikes interest rate to 0.5%,1.0
‘Russia tilt’ essential to India’s strategic security,1.0
"Man accused of hiding in woman's attic, secretly filming her after meeting on OnlyFans",0.0
"Sorry to Interrupt Your Friday, but Homeland Security is Disappearing American Citizens Off the Street | Law and Order, but Minus the Law.",1.0
Trump press secretary Kayleigh McEnany has voted by mail 11 times in 10 years,1.0
A man who carried a Confederate flag into the Capitol has been arrested.,0.0
'A Red Line Crossed': Nationwide Protests Declared for Thursday at 5PM After Jeff Sessions Fired,0.0
Anthony Fauci calls out “extraordinary stigma” gays face while standing right in front of Mike Pence,1.0
Putin's use of Force in Distant Central Asia Will Have Consequences in Europe,1.0
What would happen if Ukraine joined NATO?,1.0
Rhino poacher trampled to death by elephant; remains eaten by lions,0.0
"Kansas judge rules sperm donor not on hook for child support - A Topeka man who answered a Craigslist ad to donate sperm so two women could have a baby together is not legally the child's father and isn't required to provide financial support, a Kansas judge has ruled.",1.0
"Apple chip shortage will end, but U.S.-China supply chain ‘train wreck’ is coming",0.0
What Does Evergrande Meltdown Mean for China?,1.0
Opinion: Will Trump’s love affair with Putin finally be the breaking point for Republicans? I doubt it.,1.0
Guilty verdict in first Capitol riot trial could spell trouble for Trump,0.0
"Interesting chart showing the countries top-tier AI scientists come from, and where they work today. Russia is nowhere in site, in MENA only Iran and Israel matter, and the USA is still dominating.",1.0
'Trump kept saying it was basically pretty much a cure': Woman whose husband died after ingesting chloroquine warns the public not to 'believe anything that the president says',0.0
Judge rules against Trump lawyer John Eastman in dispute with Jan. 6 investigators,0.0
The Economic Challenge and Climate Opportunity in Supporting Ukraine: Putin’s dependence on oil-and-gas exports presents a chance to make the U.S. less beholden to fossil fuels and the autocratic governments that control them.,1.0
Opinion | Biden hides behind Ukraine’s suffering,0.0
Ukrainian Navy may receive eight British large missile boats,1.0
EU to push Australia to clean up petrol standards as part of free trade deal,1.0
"Did the West really ""lose"" in Euromaidan?",1.0
Egyptian President Sisi says Egypt won't stand idle in Libya if security is threatened,0.0
Murkowski says Biden needs to take firm action to increase energy production: 'Let's not just talk',1.0
US is close to sanctioning Chinese officials over Muslim camps,1.0
US election: Biden event in Texas cancelled as 'armed' Trump supporters threaten campaign bus,0.0
Ex-Merrill Broker to Seek Dismissal of Charges After Smoothie Shop Tirade,0.0
"Joe Biden Tests Negative Again for COVID-19, Days After Trump Is Diagnosed",0.0
Donald Trump Labelled 'Loser of the Year' by Europe's Biggest News Magazine,0.0
Mask mandate extended for airline flights and on public transportation until April 18,1.0
Faith Under Fire | A Pastor’s Legal Fight Against CBP Exposes a Reckless Surveillance Operation,0.0
Bill passes to let WV drivers carry certain loaded guns,1.0
Why is Egypt not leveraging it's position?,1.0
"Chicago teachers vote to teach from home, defying district",1.0
China's state media buys Meta ads pushing Russia's line on war,0.0
Thoughts on how the Artesh-IRGC division will play out in the case of serious destabilization to regime collapse in Iran?,0.0
Oakland passes emergency ‘hazard pay’ ordinance; grocers must pay workers an extra $5 per hour,0.0
Is current China an example of a successful fascist state?,1.0
Biden warns Russia will pay 'severe price' if it uses chemical weapons in Ukraine,0.0
"Spam website set up to reach millions of Russians. A Norwegian computer expert has created a website enabling anyone to send an email about the war in Ukraine to up to 150 Russian email addresses at a time, so that Russian people have a chance to hear the truth their government is hiding.",0.0
"What do you predict the future of the Scandinavian countries (Denmark, Norway and Sweden) will look like?",1.0
A third of the nation's honeybee colonies died last year.,0.0
Trump Supporter Arrested For Requesting Absentee Ballot For Dead Mother,0.0
India's Tech Talent Flows: A Win-Win for India-US AI Partnership.,1.0
"Disney CEO says he called DeSantis, expressed disappointment over 'Don't Say Gay' bill",0.0
Billionaire David Koch dies at age 79,1.0
North and South Korea restore communication channels after a 12 months,1.0
Trump reportedly said he would reject a bailout package if it included aid to keep the US Postal Service functioning,0.0
Man jailed for life over $20 marijuana sale has been freed,0.0
"Coronavirus: China faces fight to hang onto foreign manufacturers as US, Japan, EU make Covid-19 exit plans",0.0
"Republicans, Once Harsh Ukraine Critics, Pivot to Strong Support",1.0
"US, Japan, India and Australia simulate 'Quad' drill in Indo-Pacific",1.0
Pro-Trump rioters could face up to 20 years in prison,0.0
"Biden signs federal mask mandate, repeals Muslim Ban, and rejoins Paris Climate Agreement",0.0
"How was Russia able not only to survive the harsh sanctions, but complete projects like the NS2?",1.0
"Apple, Nike and Google join brands limiting services",1.0
Vladimir Putin says liberalism has ‘become obsolete’,1.0
"The teacher who disarmed, then hugged a student will receive the citizen Congressional Medal of Honor",1.0
Trump Just Admitted on Live Television He Will 'Terminate' Social Security and Medicare If Reelected in November,1.0
"The ""What happened in your state last week?"" Megathread, Week 10",1.0
Combat on the Venezuela-Colombia Border: What We Know,0.0
New poll shows Republican state legislature candidates leading on a generic ballot,1.0
"Putin recognizes independence of Ukraine breakaway regions, escalating conflict with West",0.0
Poll: 57% of voters say US political system works only for insiders with money & power,1.0
China declares all crypto-currency transactions illegal,0.0
R. Kelly Has Been Found Guilty Of Federal Crimes After 11 Sexual Abuse Victims Testified Against Him,0.0
Texas sues to prevent losing federal funds over its investigations of trans children’s families,0.0
Don't trust presidential polls that show huge leads for Joe Biden. The race isn't over.,0.0
U.S. And Chinese Carrier Groups Mass In The South China Sea,1.0
US intelligence warned in November that coronavirus spreading in China could be 'cataclysmic event': report,1.0
Trump reportedly invited a waiter into a top secret intelligence briefing room to order a milkshake,1.0
"Iran cracks down, kills at least 100 protesters with thousands injured amid fuel crisis",0.0
"Donald Trump shakes hands with Kim Jong-un, steps into North Korea",1.0
"Turkey’s genocide blackmail: Threats to work closer with Iran and Russia | The Biden administration has called Turkey’s bluff: that it might leave NATO because it is angry to hear the word “genocide” – and that Ankara should never be offended, but can do what it wants",0.0
"Bill To Make Abortion Felony in cases of Ectopic Pregnancy, Trafficking Victim, or 10 weeks since start of LMP in Missouri.",0.0
Pelosi backs Rep. Karen Bass in LA mayor's race,0.0
Biden administration ends Trump-era border policy for unaccompanied migrant children,1.0
Trickle-down economics is dead. It’s time to tax the rich harder,0.0
Kyle Rittenhouse found not guilty,1.0
