headline,label3
GOP Senators Couldn’t Even Convict The Man Who Sent a Mob After Them. Why Let Them Filibuster?,1.0
"National average for a gallon of gas tops $4, the highest price at the pump since 2008",1.0
"Elon Musk Throws a S--t Fit Over the Possibility of Being Taxed His Fair Share | As a reminder, Musk was worth $287 billion as of yesterday and paid nothing in income taxes in 2018.",1.0
Lithuania vs. China: A Baltic Minnow Defies a Rising Superpower,1.0
Amazon employees plan ‘online walkout’ to protest firings and treatment of warehouse workers,0.0
Modern history and Politics of Southeast Asia,1.0
Texas Supreme Court further limits challenges to state's restrictive abortion law,1.0
Trump pardons former campaign chairman Paul Manafort and son-in-law's father in another round of clemency action,1.0
"Despite the rhetoric, US-China financial decoupling is not happening",1.0
Iron ore fuelling ‘incredible’ wealth transfer from China to Australia amid feud,1.0
Santa Clara County Sheriff Laurie Smith Announces She Will Retire in January,1.0
"Oil prices fall, continuing downward trend from last week",1.0
"New York's Museum of Modern Art evacuated after two people were stabbed inside, police say",0.0
CNN fires Chris Cuomo,1.0
"United Airlines saves 170,000 gallons of fuel by using lighter paper on inflight magazine",1.0
"Opinion: If you’re ‘essential’ enough to work through a pandemic, you’re essential enough to be paid a living wage",1.0
Map: North Macedonia Joins NATO,1.0
Belarus plane arrest - is it a first?,0.0
Megathread: Representative Marjorie Taylor Greene (GA-14) Stripped of House Committee Assignments,1.0
Pandora Papers: An offshore data tsunami - 11.9 million records from 14 different offshore services firms ICIJ,1.0
Does mutually assured destruction really exist for non-nuclear NATO countries?,0.0
France has been able for decades to station large forces across its former imperial lands in Africa which have contributed to its current Operation Barkhane mission. But would the likes of Germany or Italy or even the UK have the effective capability to mount and run their own operation akin to that,1.0
Madison Cawthorn charged with driving with revoked license for 2nd time; court dates set,0.0
Buffalo officials ask state to probe firing of Black officer who stopped white colleague's chokehold,0.0
Nationalize All the Oil Companies - The price of oil and the myriad horrors of climate change that oil exacerbates make it too important for us to leave in the free market’s hands. The oil companies should be nationalized.,1.0
Biden’s Approval Rises in Crisis,0.0
Twitter now alerts Trump that Biden is president every time he lies about election fraud,0.0
Spectator who caused massive crash at Tour de France missing after fleeing the country,0.0
"Congressman calls for service members, veterans who stormed the Capitol to be stripped of benefits",1.0
"Likelihood of criminal charges against Trump rising, experts say",0.0
Police officer sued after shooting puppy dead in front of its owners,0.0
‘Stop it’: Biden tells states to drop ‘new Jim Crow’ laws and praises companies ‘speaking up’ over Georgia voting restrictions,1.0
Twitter bans political ads after Facebook refused to do so,0.0
What have been the successful United Nation peacekeeping missions?,1.0
Belarus’ leader vows the country won’t become part of Russia,1.0
How did Somalia become a failed state? [13:22],0.0
The Eye of the Storm: Why Does Kyiv Seem So Strangely Calm? - DER SPIEGEL,1.0
"What role do you think tunnels are going to have for rebels, terrorists and guerilla warfare in the future?",0.0
Joe Manchin has no time for consequences,0.0
BofA says Covid crisis will delay India overtaking Japan as third-largest economy by 3 years,0.0
"Biden team unveil 10-day timetable to ""reverse"" Trump admin's ""gravest damages""",0.0
"While Constantly Yelling About Voter Fraud, Trump Tried To Register In FL With WH Address",0.0
Vermont has officially legalized cannabis,1.0
India’s economy OVERTAKES France to become sixth largest in world | World | News,1.0
"Britney Spears’ father removed as her conservator, judge rules",1.0
Biden bans Russian oil imports to U.S.,1.0
Black disabled Veteran Sean Worsley sentenced to spend 60 months in Alabama prison for medical marijuana,0.0
Elizabeth Warren says Jeff Bezos 'forgot to thank all the hardworking Americans who actually paid taxes' after his space flight,1.0
"The No-Fly Zone Delusion: In Ukraine, Good Intentions Can’t Redeem a Bad Idea",0.0
LGBTQ Floridians once hoped DeSantis could be an ally. Not anymore,1.0
Sinclair Forces Local TV Stations to Air Segment Defending Tear-Gassing Migrants,1.0
Pentagon says Polish proposal to transfer jets to US to give to Ukraine isn't 'tenable',1.0
Florida fails to pass condo safety measures following Surfside collapse,0.0
Taylor Swift: Trump's 'calculated dismantling' of USPS proves he's trying to 'blatantly cheat' election,0.0
The Army wants you to get smart on China’s military structure and tactics,1.0
"Family of Tom Petty issues Cease and Desist to Trump's campaign after Tulsa rally. They said the president cannot use the song ""I Won't Back Down"" to further a campaign that leaves Americans and common sense behind.",0.0
'I saved his a--': Trump boasted to Woodward that he protected Saudi Crown Prince Mohammed bin Salman after Jamal Khashoggi's brutal murder,0.0
"Mitch McConnell's Louisville home vandalized following his blockage of $2,000 checks",1.0
"Faculty member, school resource officer shot at Olathe East",1.0
Texas valedictorian goes viral after giving unapproved speech blasting state's anti-abortion bill,1.0
Indonesian State Formation and its Geostrategic Posture,1.0
Why is French intervention in African countries often overlooked? Where's the media lens on the ramifications of FranceAfrique?,0.0
"Kinzinger: ""Biggest regret"" is voting against Trump's first impeachment",0.0
"Of the military powers on the African continent, what are their capabilities?",1.0
"European deputy: ""The US turns its back, Europe must wake up!""",1.0
Iran fails to explain uranium traces found at several sites -IAEA report,0.0
Russia holds Americans captive as Joe Biden vows to bring them home,1.0
"What will be the ""Spices of the 21st century""?",1.0
Republican candidate says he tells daughters to ‘lie back and enjoy it’ if rape is inevitable,0.0
"Geopolitically speaking, what are the countries that can punch above their weight?",1.0
Calls grow louder to boycott Beijing’s Olympics — and analysts warn of retaliation from China,0.0
"Bernie Sanders Is Right, and Joe Biden Is Wrong. We Still Need Medicare for All.",0.0
Warnings of Possible Cover-Up in Progress as Trump Orders Hospitals to Stop Sending Covid-19 Data to CDC,0.0
Royal Navy finds uninhabited Henderson Island has been marked on charts in the wrong place for 85 years,0.0
Misinformation dropped dramatically the week after Twitter banned Trump,0.0
"Idaho librarians could face jail time for lending ""harmful"" books",1.0
GOP lawmaker wants to criminalize vaccine mandates in Tennessee,1.0
"A Politically Savvy Prosecutor Is Tanking Orange County’s Justice System Through Racism, Ego, And Retaliation, Insiders Say",0.0
Michigan AG first charges filed in investigation of Boy Scouts of America,0.0
What do you think could the potential for Pak - Central Asia trade if Afghanistan calms down?,1.0
Massachusetts mayor first in line as recreational marijuana sales begin,1.0
Jeopardy' host Alex Trebek has stage 4 pancreatic cancer,0.0
"Kentucky's Student Voice Team surveyed 10,000 students about race. Here's what they found.",1.0
Hypothetical geopolitical consequences of a post-Putin Russia,1.0
Senate passes government funding bill with $13.6 billion in Ukraine aid,1.0
"Trump Campaign Secretly Paying $180,000 A Year To His Sons’ Significant Others | Lara Trump and Kimberly Guilfoyle are each receiving $15,000 per month through the campaign manager’s private company, GOP sources said, to dodge FEC rules.",1.0
"Only 34 police officers defy New York’s vaccine mandate after union threatened 10,000 would quit",0.0
"Covid: Seven year old dies of coronavirus in Georgia, a day after Trump said children are ‘almost immune’",1.0
Dr. Anthony Fauci says he won't walk away from 'this outbreak no matter who's the president',0.0
The 2022 Geopolitical Reading List [Encyclopedia Geopolitica],1.0
"Ugandan, Congolese forces continue offensive operations in eastern DRC",0.0
Billionaire-Backed Group Enlists Trump-Supporting Citizens to Hunt for Voter Fraud Using Discredited Techniques,0.0
"Egypt seeks middle ground between US, Russia as Ukraine fighting rages",0.0
What the New China Focus Gets Wrong,0.0
Putin Flexes His Muscles in Syria in Test of Israel’s New Leader,1.0
100K borrowers eligible for debt cancellation under new Biden student loan rules,0.0
Pakistan’s Imran Khan shows in an Axios interview how China buys silence on the Uyghurs,1.0
Target to keep stores closed on Thanksgiving for good | AP News,1.0
"Sanders: ""Richest 1 Percent Is Responsible for 70 Percent of All Unpaid Taxes""",1.0
France says Vladimir Putin is moving towards de-escalating Ukraine crisis,0.0
EPA is now allowing asbestos back into manufacturing,1.0
US cuts Pakistan’s aid by $440 million,0.0
Massive procession of Chinese military vehicles gathering along the Hong Kong border,1.0
Ethiopia has slammed a Trump suggestion Egypt could blow up its Grand dam,1.0
"Jailers Interrupt Ghislaine Maxwell's Sleep Every 15 Minutes to Check If She's Still Breathing, Lawyer Says",0.0
Man arrested for groping woman on flight says 'President says it's OK to grab women's private parts',0.0
"President Abbas declares end to agreements with Israel, US; turns over responsibility on occupied lands to Israel.",1.0
"U.S. IRS plans 10,000 hires to help clear millions of unprocessed tax returns",1.0
THP trooper terminated after pulling face mask off protester,1.0
Michigan man jailed for nearly 4 decades exonerated after witness admits to lying,0.0
Antimonopoly Power: The Global Fight Against Corporate Concentration,0.0
"Opinion | Welcome to Londongrad, Where Kleptocrats Wash Their Money Clean",1.0
Belarus accused of ‘hijacking’ Ryanair flight diverted to arrest blogger,0.0
Anonymous security forcing citizens into cars is mark of dictatorship,1.0
'I don't kid': Trump contradicts aides and insists he meant it when he asked for coronavirus testing to be slowed down,1.0
"They. Sold. Their. Stock. They could have made a difference, but they made a profit.",1.0
"Tigrayan forces’ capture Kombolcha, a vital supply route and strategic junction, raising fears for Ethiopian capital | Ethiopia",0.0
The Modern China-Russia-US triangle,1.0
D.C. board rules that officer who committed suicide after Jan. 6 died in line of duty,0.0
A post-post-9/11 era? The US withdrawal from Afghanistan and the China question,1.0
Trump White House edits Putin support for Trump out of transcript and video,1.0
"Even mild Covid is linked to brain damage months after illness, scans show",0.0
"China Warns U.S. Over Forming Pacific NATO, Backing Taiwan",0.0
Biden administration weighs turning over Trump tax returns to House Democrats,1.0
"Ukraine, NATO launch joint Black Sea drills",1.0
Transitioning to renewable energy and risking energy security,1.0
New York Gov. Cuomo signs executive order that allows store owners the right to ban any customer that enters without wearing a mask.,0.0
20 leading economists just signed a letter arguing Medicare for All would generate massive savings for American families,0.0
Korean leaders meet in surprise summit,1.0
"Astronaut’s DNA No Longer Matches His Identical Twin’s After Year Spent in Space, NASA Finds",0.0
China vows to stop UK granting Hongkongers residency,1.0
Republicans weigh approach for Ketanji Brown Jackson nomination fight,0.0
Federal judge blocks Texas governor's order limiting mail ballot drop-off locations,0.0
"NYPD officers can no longer search a vehicle due to the smell of marijuana alone, new memo says",0.0
How well has Iran fared under Trump maximum pressure?,0.0
Putin to U.S.: I'm ready for another Cuban Missile crisis if you want one,0.0
"A veteran died in a Florida jail. Two years later, video shows he was tased, left convulsing in a cell.",0.0
Venezuela wins right to appeal UK ruling on who their president is,1.0
Why record-high gas prices won't be solved by drilling more oil in the US,0.0
Statement by President Biden on Consumer Price Index in February,1.0
Hedge fund billionaire Steve Cohen leaves Twitter after family receives threats amid GameStop backlash,0.0
"Pence, Not Trump, Gave Order to Activate National Guard: Report",1.0
What factions currently exist within the Chinese Communist Party?,1.0
Texas man guilty in first jury trial conviction over US Capitol riot,0.0
Who initiates the transfer of Afghan Islamists to the Caucasus?,1.0
Books About China's Rise to Becoming a Superpower/Overview,1.0
How to Save Democracy From Technology: Ending Big Tech’s Information Monopoly,1.0
Do Buffer States Serve A Purpose Nowadays For Nuclear Countries?,1.0
CNN's Anthony Bourdain dead at 61,0.0
The US/China conflict is likely to escalate in the future. This is not a fight between equals as is often portrayed in the media.,0.0
"Denver police officer fired for ""Let's start a riot"" post during George Floyd protest",0.0
Trump pardon of Blackwater Iraq contractors violates international law - UN,0.0
Post-election audits find no fraud in Arizona,0.0
Former Proud Boys chairman charged with conspiracy.,0.0
"Turkey and Libya signed a maritime border agreement despite not having actual borders. Greece called it a geographical absurdity, and Egypt is angry.",0.0
CNN suspends Chris Cuomo indefinitely,1.0
"Happy Cakeday, r/Crimes! Today you're 10",1.0
Minister says Britain must reduce military dependence on US,1.0
UPS ends ban on beards and natural Black hairstyles,0.0
Dr. Fauci Says Not Having to Deal With a Lying President is ‘Liberating’,0.0
When Should States be able to Declare Independence? When Should they be able to be Recognised?,1.0
Investigators recommend no charges for US Capitol Police officer accused of killing pro-Trump rioter during insurrection,0.0
Stephen Hawking to Be Buried Between Darwin and Newton.,1.0
"What on earth is going on between Greece, Turkey and the EU?",1.0
"Illinois governor pardons 11,000 for low-level marijuana convictions",1.0
"Trump Says He 'May Have To' Run in 2024 During Rambling, Lie-Filled South Carolina Rally Speech",1.0
"Solomon Islands to sever ties with Taiwan, shift alliance to Beijing",1.0
"United CEO doubles down in email to employees, says passenger was 'disruptive and belligerent'",1.0
Pressure on Ted Cruz Grows as Third Texas Newspaper Calls for Him to Resign,0.0
Law Firm Stops Representing Trump Campaign in Pennsylvania Suit,0.0
China's bet U.S. is bluffing on Taiwan war risks dangerous miscalculation,0.0
Trump: Just Mark U.S. Planes With Chinese Flag and Bomb Russia,0.0
Vice President Mike Pence tours Mayo Clinic without coronavirus mask even though he was told to wear one,1.0
Biden administration launches new ‘KleptoCapture’ task force to go after Russian oligarchs,1.0
"Pentagon announces plan to empty Red Hill fuel tanks, permanently close facility",0.0
"Amy McGrath Takes Narrow Lead Over Mitch McConnell in Kentucky Senate Race, Poll Shows",1.0
U.S. Rep Madison Cawthorn faces charge of driving with revoked license,1.0
"The Trump administration paid a bankrupt company with zero employees $55 million for N95 masks, which it's never manufactured",0.0
"Missiles target US consulate in Erbil, Iraq - report",1.0
What geopolitical consequences will have Taliban gaining control of Afghanistan?,1.0
Why would Russia wait until now to invade Ukraine?,1.0
"In rare joint message, top U.S. military leaders condemn Capitol riot",0.0
Can Spain maintain its territorial integrity?,1.0
EU to back Spain over Gibraltar claims,1.0
"As US exits Afghanistan, China eyes $1 trillion in minerals",1.0
Do you think there was a better way to resolve the Armenia-Azerbaijan conflict other than war?,0.0
"China-backed hackers breached government networks in at least six US states, per new report - Members of the hacking group are among the FBI’s most wanted cybercriminals",1.0
Mariupol under siege: 'We are being completely cut off',0.0
Fox News publishes digitally altered and misleading images of Seattle demonstrations,0.0
"Trump pardons former national security adviser Michael Flynn, who pleaded guilty to lying to the FBI",0.0
Humanitarian Crisis Unfolds In and Around Nagorny Karabakh,0.0
"China played leading role in spreading Covid-19 conspiracies, investigation finds",1.0
Out Chicago mayor Lori Lightfoot sued after bragging “I have the biggest d**k in Chicago”,1.0
Emmanuel Macron warns Europe: NATO is brain-dead,0.0
Biden-Xi talks: US says opposed to 'unilateral effort' to change Taiwan,1.0
Rapper DMX Has Died at 50,0.0
Asian leaders plan to strike RCEP trade deal on Sunday without India,0.0
"Oregon Gov. Kate Brown will declare emergency, ready National Guard ahead of election",0.0
Geopolitical analyst on the Russian topic,1.0
Ted Cruz's Approval Rating Among Republicans Drops More Than 20 Percent After Cancun Fiasco,0.0
Florida’s “Don’t Say Gay” Bill Compounds Trauma for LGBTQ Students of Color,0.0
Woman wanted for allegedly stealing Nancy Pelosi’s laptop arrested,0.0
Biden declares October 11 Indigenous Peoples' Day and says restoring national monuments is the 'easiest thing I've ever done so far as President',1.0
Protests in Belarus against integration with Russia (livestream),0.0
Hoyer says Russian gas ban is worth political cost,0.0
White House suspends CNN reporter's access,1.0
Megathread: Justice Department Investigating Potential Presidential Pardon Bribery Scheme,1.0
Putin was wrong about everything. But so were U.S. right-wingers.,0.0
Why doesn't the EU support more France against Turkey?,0.0
"Purdue Pharma deal has families deflated, angry but hopeful",1.0
What can the UN General Assembly do about Russian Aggression in Ukraine?,0.0
Defecting Chinese spy offers information trove to Australian government,0.0
The Case for Monarchy in Libya: Could a Monarch Heal Libya?,1.0
"Video showing hundreds of shackled, blindfolded prisoners in China is 'genuine'",0.0
Arizona Certifies Biden’s Election Victory Over Trump,1.0
Oil prices plunge as UAE supports supply boost,1.0
Biden leads by 10 points as majority of Americans say Trump could have avoided coronavirus: Reuters/Ipsos poll,0.0
"Police officer fired after ""fabricating"" story about being served McDonald's coffee with ""f***ing pig"" written on cup",0.0
First Jan. 6 attacker to go to trial guilty on all five counts,0.0
"Chuck Schumer made sure businesses controlled by Trump, his family, and top US officials couldn't get money from the government's $2 trillion coronavirus bailout fund",1.0
Russian wargames and other elite decision-maker studies on nukes,1.0
Initial reports: 2nd filing of Ethiopian Nile Dam already underway this week as heavy rainfall hits Ethiopia.,1.0
"Ted Cruz and Josh Hawley could be put on no-fly list, House homeland security chair says",1.0
Macron announces a 'Space Force',1.0
"Apple admits it slows older iPhones, confirming Geekbench report",1.0
"For Thousands of Years, Egypt Controlled the Nile. A New Dam Threatens That.",0.0
"Child porn ring leader beaten to death at detention center, authorities say",0.0
The pandemic has made this much clear: those running the US have no idea what it costs to live here,1.0
Finnair reports GPS jamming near Kaliningrad,1.0
Would the international community accept a peace treaty where one country ceded land?,1.0
AP News: AP Source: Biden to ban Russian oil imports over Ukraine war,0.0
The Trump Organization Planned To Give Vladimir Putin The $50 Million Penthouse In Trump Tower Moscow,1.0
USA now vaccinating more people against COVID-19 in one day than Canada has in total,1.0
Agents raid home of fired Florida data scientist who built COVID-19 dashboard,0.0
"Democracy Is Dying in Brazil: To Stop Bolsonaro, the Opposition Must Unite",0.0
"As Inflation Soars, So Do Corporate Profits",1.0
Megathread: GOP Rep. Matt Gaetz Under Investigation for Alleged Sexual Relationship with 17-Year-Old Girl,1.0
Judge throws out challenge from Republican lawmakers against House mask mandate,1.0
An interesting data visualization for seeing the gap between the US and everyone else.,1.0
Arizona Republicans surprise everyone by helping to kill anti-transgender bills,0.0
Uyghur Tribunal is a litmus test of the human rights establishment,1.0
Green Upheaval: The New Geopolitics of Energy,1.0
Why Europe should focus on agricultural support in Syria,1.0
"Donald Trump has real estate debts of $1.1B with $900m owed in next four years, report says",1.0
"Far-right activist Ammon Bundy claims ""ambush"" after hospital arrest",0.0
A Message to PBS: Televise the Trump Impeachment Hearings for All to See,1.0
A Measure Short of War: The Return of Great-Power Subversion,0.0
Missouri Bill Would Make Aborting An Ectopic Pregnancy A Felony,0.0
A Rival of America’s Making?: The Debate Over Washington’s China Strategy,1.0
"Are UK-China ties strengthening and if so, how will this affect the rest of the world?",1.0
"Trump said 'only blacks could live this way' about Chicago and hates Obama because he's Black, Michael Cohen claims",0.0
American Democracy Is Broken. Can Proportional Representation Fix It?,0.0
Books to learn about the United Nations?,1.0
"Singapore is such a powerhouse, that both Malaysia and Indonesia have built large cities with giant ports around it. What's Singapore plan to stay ahead of the competition?",1.0
"Colorado governor signs police accountability bill, ending qualified immunity defense in the state",1.0
Caspian Report: Geopolitics of the South China Sea,1.0
Apple confirms it uses Google's cloud for iCloud,1.0
Youngkin could set Virginia education back 'many years’: Read the withering letter from school superintendents blasting governor,1.0
"Police shoot, kill 12-year-old boy after bullet hits cop car",0.0
China-EU investment deal: leaders conclude marathon negotiations via video link,1.0
China tests new space capability with hypersonic missile,1.0
Michigan powerlifter heroically lifts vehicle pinned on top of man after accident.,1.0
Nile dam's first-year target reached - Ethiopia,1.0
President Trump has been impeached,1.0
"French President Macron's diplomacy in Lebanon has backed CMA CGM's efforts to land a Beirut Port deal. Macron has called 21s century ""a maritime one"" amid growing trade to the EU via the Mediterranean Sea, where China also has expanded its foothold at Piraeus port",1.0
'It'll cause a water war': divisions run deep as filling of Nile dam nears,1.0
"Why does Qatar, a regular Gulf monarchy, act completely differently from their fellow Gulf monarchies?",1.0
"Sri Lanka offers strategic deep-sea port to India, Japan",1.0
Poll: 60 percent support Biden canceling up to $50K of student loan debt per person,1.0
"Man dies after police kneel on his neck for nearly 5 minutes, family says in wrongful death claim",0.0
Vice President Mike Pence and Wife Voted by Mail in April Using Old Indiana Address,1.0
"Judge orders Walmart to rehire worker with Down syndrome, provide more than $50,000 in back pay",0.0
Justice Department ends limiting compassionate release in plea deals after NPR story,1.0
"European Union-style bloc pitched for Latin America, Caribbean",1.0
Is there any lessons from history for a small countries flanked by 2 opposing superpowers?,1.0
"Trump, who told Obama to resign after one Ebola death, calls 160,000 COVID-19 deaths ""fantastic job""",0.0
"Petition Urging Proud Boys Be Listed as Terrorist Organization Hits 400,000",0.0
How the conflict in Ukraine threatens US cybersecurity,0.0
"Neil deGrasse Tyson Cleared by Misconduct Investigation, Will Keep Museum Job",1.0
The Plot Against China? How Beijing Sees the New Washington Consensus,1.0
Terry Crews Shares His Own Story of Sexual Assault by a Hollywood Executive,0.0
Suspension Lifted of Georgia Student Who Posted Photos of Crowded Hall,1.0
Poland ready to place all its MIG-29 jets at the disposal of the U.S.,1.0
US makes official return to Paris climate agreement,1.0
Comey Memo Says Trump Asked Him to End Flynn Investigation,1.0
"High turnover, understaffing, low pay: US nurses fight to unionize",0.0
72 Democrats sign motion to expel Marjorie Taylor Greene from Congress,0.0
NASA Fixes Mars Lander By Telling It to Hit Itself With a Shovel,1.0
US imposes sanctions on three Russian individuals. Why?,0.0
War in Ukraine Rallies Support in Congress for More Military Spending,0.0
"Thailand cave rescue: All 12 boys, coach freed, latest updates",1.0
Twitter blocks Russian claims on hospital attack,0.0
Biden says US will defend Taiwan if China attacks,0.0
Family O Five YouTube taken down permanently,1.0
Microsoft tried a 4-day workweek in Japan. Productivity jumped 40%,1.0
Defense: Pot fueled ‘crazy talk’ of men accused in kidnapping plot,0.0
"Man who spent weekend in a bunker demands ""weak"" governors ""dominate"" protesters",0.0
Black homeowner had a white friend stand in for third appraisal. Her home value doubled.,1.0
An Indiana teacher granted early retirement after hitting a student in the face is charged with battery,1.0
‘They're preparing for war’: An expert on civil wars discusses American extremism,0.0
"Opinion: Yes, voters ‘deserve to know’ this GOP plan would raise taxes by $1 trillion",1.0
