headline,label3
THE UAE'S RED SEA STRATEGY,1.0
Woman Who Called Michelle Obama An 'Ape' Sentenced To Jail For Defrauding FEMA of $18K,0.0
"We are all aware of the impact the Internet has had on diplomacy and geopolitics, but what of the humble telegraph? Podcast interview with Tom Standage, author of 'The Victorian Internet'",1.0
How were European states able to control their colonies so easily in the 19th and 20th centuries while the United States cannot placate third-world countries in the 21st century?,1.0
Jeff Bezos (CEO of Amazon) is refusing a request for testimony from congress while they threaten subpoena.,0.0
Nation’s largest children’s hospital pauses gender-affirming care after Texas governor’s threats,1.0
Cawthorn calls Zelensky a 'thug' and Ukrainian government 'incredibly evil',0.0
US Hegemony: Cui Bono,1.0
Republican Adam Kinzinger: “I should have voted to impeach Trump over Ukraine.”,1.0
"Serbia designates Hezbollah as terror group, earning praise from US",1.0
"Ethiopian government launches ‘staggering’ new offensive against rebel Tigray forces, group says",0.0
"""QAnon Shaman"" Jacob Chansley sentenced to 41 months in prison for role in January 6 attack",0.0
"US, NATO and the Question of Russia",1.0
UK Bans Huawei From 5G Networks in Major Policy U-Turn,1.0
Japan urges Europe to solidify military involvement in Indo-Pacific,1.0
Map Update: African Union Suspends Mali Again,1.0
Iceland to end whaling in 2024 as demand dwindles | Whaling | The Guardian,0.0
Christopher Columbus statue beheaded in Boston,1.0
"H.Res.755 - Impeaching Donald John Trump, President of the United States, for high crimes and misdemeanors",1.0
Why Did Mark Meadows Register to Vote at an Address Where He Did Not Reside?,1.0
"Trump ousts Homeland Security cyber chief Chris Krebs, who called election secure",1.0
"'I'll be right eventually': Trump again insists coronavirus will disappear, citing no evidence",0.0
US Democrats nix $1B Dollar support for Israels Iron Dome Defense system,1.0
Deterrent to ransomware attacks targeting critical infrastructure?,0.0
Bernie Sanders Wins the Nevada Caucuses,1.0
"Study finds more than half of Michigan students between first, third grades had reading deficiency: ""More than three full school years into Michigan's controversial Read by Grade Three law, 52% of Michigan's third-grade students had a reading deficiency""",0.0
Does the U.S pulling out of Afghanistan send the wrong type of message to Iran or other hostile actors in the Middle East or else where?,0.0
"Thousands of Seattle students told to get vaccinated, or don’t come back after winter break",1.0
Trump and Giuliani sued for conspiracy to incite deadly Capitol riot,0.0
15 Miami-Dade educators die from COVID-19 in 10 days,0.0
Facebook temporarily allows posts on Ukraine war calling for violence against invading Russians or Putin's death,0.0
Anonymous Source Tells Times Reporter Don Jr. Is Worried His Father Will Lose And Whole Family Will Be Prosecuted,0.0
The Obscure Legal Doctrine That Conservatives May Use to Destroy Free Elections,1.0
"Stacey Abrams on long lines to vote: ""It’s a Poll Tax when someone has to risk an entire day’s wage""",0.0
Megathread: President Trump Pressures Georgia Secretary of State to Recalculate the Vote in His Favor in Leaked Phone Call,0.0
"Father buys $64,259 ad calling for police to reopen investigation into son's death",0.0
[Foreign Policy] China Is a Declining Power—and That's the Problem,0.0
"Cawthorn calls Zelensky a 'thug,' Ukrainian government 'evil' in video",1.0
"Japanese bonsai owners urge thieves to water stolen 400-year-old tree worth $127,700",0.0
Kellyanne Conway announces she tested positive for coronavirus,1.0
Graham signals he's a likely 'no' on Biden SCOTUS pick,1.0
Judge denies bail for Ghislaine Maxwell after she pleads not guilty in Jefferey Epstein sex crimes case,0.0
Russian and British foreign ministers exchange barbs after frosty Moscow meeting,1.0
Trump Just Exposed Secret Service to COVID-19 to Do a Drive-By For MAGA Supporters,1.0
Biden directs $200 million in defense aid for Ukraine,1.0
Japan is 'shocked' and furious at the US after a major coronavirus outbreak at 2 Marine bases in Okinawa — and says the US is not taking the virus seriously,0.0
Coca-Cola suspends business in Russia,1.0
"Not at Any Price: LBJ, Pakistan, and Bargaining in an Asymmetric Intelligence Relationship - Texas National Security Review",1.0
Bernie Sanders: Washington’s Dangerous New Consensus on China,0.0
What are the geopolitical faultlines/hot spots throughout Africa?,1.0
"Arizona McDonald's employee, 16, fatally shot at work, police say",0.0
"Trump imposing new aluminum tariff, Canada readies countermeasures",0.0
"India says it only follows U.N. sanctions, not unilateral US sanctions on Iran | Reuters",1.0
U.S. lawmakers seek permanent ban on illicit types of fentanyl,0.0
NATO Enlargement and Realism,1.0
A truck driver from Brooklyn wins $298 million Powerball Jackpot,1.0
"French troops stay in Mali after coup, no end in sight",0.0
Unqualified Impunity: Amy Coney Barrett Once Ruled That a Cop Wasn't Responsible for a Black Teenager's Death Because Breathing Isn't a Constitutional Right,0.0
Alaska Airlines banned her for refusing to wear a mask. Now state Sen. Lora Reinbold can't reach the capital to vote.,0.0
"McDonald's, other CEOs have confided to Investors that a $15 minimum wage won't hurt business",1.0
"Former Lawrence police officer arrested on suspicion of raping 20-year-old while he was on duty, 24 other counts",0.0
"K Street was fine taking Russian cash — until it couldn't | Even after the annexation of Crimea and the hacking of the DNC, firms took on major Russia clients. Then came the sanctions.",1.0
Andrew Cuomo To Resign Amid Sexual Harassment Allegations,0.0
"Connecticut GOP candidate, former bank CFO, brags about assets linked to human rights abuses",0.0
Leaked Audio of Sen. Joe Manchin Call With Billionaire Donors Provides Rare Glimpse of Dealmaking on Filibuster and January 6 Commission,0.0
"Greece blocks 10,000 migrants at Turkey border",0.0
US officials fly to Venezuela for talks in apparent bid to further isolate Russia,0.0
Ukrainian embassy draws US citizens seeking to fight in war,0.0
"After al-Bayda, the Beginning of the Endgame for Northern Yemen?",1.0
"How long will it take for a developed country to make nuclear weapons, in the case of a global conflict?",0.0
Child sex offenders to be named as such in US passports,0.0
Fact check: McConnell claims Obama didn't leave Trump a pandemic 'game plan.' Obama left a 69-page playbook,1.0
"With $100B internet plan, Biden commits to bring down ‘overpriced’ broadband bills",1.0
FL Sen. Rick Scott’s tax plan under fire from White House,0.0
"Florida says healthy kids shouldn’t get COVID vaccine, contradicting CDC",1.0
US Ice officers 'used torture to make Africans sign own deportation orders',0.0
Right-wing social media app Parler has been removed from the Google Play store,1.0
Andrew Cuomo after Trump debate attack: 'New York has a lower infection rate than the White House',0.0
Kanye West's Yeezy got millions in federal small business loans,1.0
Report: Kootenai County Republicans plan to 'take over' Democratic party by having Republicans run for Democrat positions,1.0
Michigan GOP candidate slammed for saying rape victims should “lie back and enjoy it”,0.0
Sanders overtakes Biden in New Hampshire poll,1.0
These 69 House Reps Voted Against Providing Ukraine Aid,1.0
Central African fighters prepare to join Russian troops in Ukraine,1.0
Juror at centre of Ghislaine Maxwell trial controversy to go before judge,1.0
Stacey Abrams says 750K Georgians have requested ballots for runoff,1.0
"Publix buys 5 million pounds of produce to support local farmers, donates to food banks",1.0
Biden designates Colombia as 'major non-NATO ally' in bilateral meeting,1.0
Russian “new Weapons”: from Deterrence to Coercion?,1.0
Florida Republican Wants to Exclude Felons From Minimum Wage Increase Because Florida Republicans Are Terrible People,0.0
US has slowest population growth rate in a century as births decline,1.0
Former Diplomat Says Iran Has No Choice But To Return To Talks,0.0
New York State Bar moves to revoke Rudy Giuliani's membership - report,1.0
Tucker Carlson Somehow Blames U.S. For Russia's War,0.0
CIA director warns Russian spies of ‘consequences’ if they are behind ‘Havana Syndrome’ incidents,0.0
Rebel-held Syria shifts power -- towards solar - France 24,1.0
"The 2020 census undercounted Latino, Black and Native American people",1.0
Why China Is Alienating the World: Backlash Is Building—but Beijing Can’t Seem to Recalibrate,1.0
Books on China and Russia/Ukraine (to better understand what I'm reading in the press regarding current events),1.0
Oregon GOP Chair Quits Over ‘Wickedness’ Within His Party,1.0
"Disney to stop paying 100,000 workers but is still on track to give shareholders $1.5 billion",0.0
Israel and Hezbollah close to war: An Analysis,0.0
The Dictator’s New Playbook: Why Democracy Is Losing the Fight,0.0
"""Is that too socialist too?"": AOC pleads for second stimulus checks and rent forgiveness as pandemic rages",0.0
"As Trump Says 'Voting Is An Honor' in Rant Against Mail-In Ballots, Progressives Respond: 'Voting Is a Right' - ""Voting isn't a gift given by leaders. Citizens have the right to vote.""",0.0
Megathread: FBI Announces They’ve Foiled a Plot to Kidnap Michigan Governor Whitmer,1.0
Oxygen-dependent man dies 12 minutes after PG&E cuts power to his home,0.0
"Woman billed $700 after sitting in ER waiting room for 7 hours, leaving without treatment",1.0
Family outraged that LAPD officers won’t face charges in shooting that killed Trader Joe's manager,0.0
"Jeffrey Epstein flew to Virgin Islands with 11, 12-year-old girls in 2018, witness says",1.0
No Charges for 5-Year-Old Who Left Teacher Hospitalized in Pembroke Pines School Attack,0.0
Any geopolitical podcast recommendations similar in style to The Red Line and Angry Planet. Or just any standout geopolitical podcasts.,0.0
Marjorie Taylor Greene locked out of Twitter as Democrats move to expel her from Congress,0.0
Pelosi says Democrats to introduce bill to bring back net neutrality this week,1.0
Body camera video shows Minneapolis officers shooting Black man during no-knock warrant. Attorneys say he wasn't the target,1.0
US approves $7.5 billion in foreign weapons sales in one day,0.0
UN says Yemen war killed or injured 47 children in 2022,0.0
Ethiopia's Tigray crisis: How the conflict could destabilise its neighbours,0.0
Pakistans Two Front War,0.0
"Even in war, the GOP’s search for ways to undermine Biden never ends",0.0
A World Without American Democracy? The Global Consequences of the United States’ Democratic Backsliding,1.0
Russia's War Has Given Biden A Chance To Ditch Trump's Failed Venezuela Policy,0.0
Judge reinstates third-degree murder charge against ex-cop charged in George Floyd's death,0.0
U.S. Intel Shows Russia Plans for Potential Ukraine Invasion,1.0
Remove Trump From Office,1.0
U.S. Bases in Central Asia: Where Will They Go?,1.0
Zara and Paypal suspend business in Russia over Ukraine invasion,0.0
Steve Bannon indicted in scheme to defraud donors to campaign pledging to build border wall,1.0
Iran candidate says he’s willing to potentially meet Biden,1.0
Japan to scrap 1% GDP cap on defense spending: Minister Kishi,1.0
"Sanders Applauds New Medicare for All Study: Will Save Americans $450 Billion and Prevent 68,000 Unnecessary Deaths Every Year",1.0
Exxon is quitting its last Russian project,1.0
"For the smaller nations of NATO who have contributed to the mission in Afghanistan, has their involvement transformed their forces?",1.0
Indian Buildup at Galwan captured by Chinese Commercial Satellites. img date: 19/06/2020,1.0
"Eddie Van Halen, Guitar Hero, Dies At 65",1.0
U.N. Security Council likely to meet next week on Ethiopia dam,1.0
Federal judges are retiring now that Joe Biden will pick their replacements.,1.0
Trump aides reportedly had to explain to the president that his demand to 'Stop The Count' would actually guarantee his loss,0.0
Why have China and Russia acted so diplomatically aggressive recently?,0.0
Report: Petrostates Face $9T Shortfall By 2040 Due to Energy Transition,1.0
Why did OPEC ( persuaded by Saudi Arabia) cut production and essentially handed market share to US oil?,1.0
America Is Not Ready for a War With China: How to Get the Pentagon to Focus on the Real Threats,0.0
"America unseats Russia, Saudi Arabia as No. 1 oil producer",0.0
"China has created 'dystopian hellscape' for Uighurs in Xinjiang, says Amnesty",1.0
Florida House passes bill creating election police force - CNNPolitics,1.0
"Goodbye, Melania",1.0
Biden says he'd like live onscreen fact checks to combat Trump 'lies' during debates,1.0
Biden signs order on cryptocurrency as its use explodes,1.0
Charles Manson Dead After Spending 46 Years Behind Bars,0.0
City gets public backlash for spending federal COVID relief money on golf course clubhouse,1.0
China Shuts Down Its Legal Ivory Trade,1.0
[Politics] - What Was Trump’s ICE Director Doing at AFPAC’s ‘Nazi Conference’? | The Daily Beast,1.0
Defense for men involved in plot to kidnap Michigan Governor over COVID restrictions claim entrapment.,1.0
"Dr. Fauci throws first pitch, players take knee for racial injustice on Opening Day",0.0
Yoon Suk-yeol: South Korea Needs to Step Up,1.0
"‘Bye, Betsy’: Educators Celebrate the End of the DeVos Era",1.0
Biden accuses Turkey of undermining fight against ISIS in Syria,0.0
"Commitments Made by the G7/8, 1975-2017 [OC]",1.0
Hospitals Sued to Keep Prices Secret. They Lost.,0.0
Pelosi orders flags at half-staff for Capitol officer that died,0.0
A transatlantic climate alliance,1.0
House Democrats Push Biden to Build a Better Midterm Message,1.0
Trump revealed highly classified information to Russian foreign minister and ambassador.,1.0
Why haven't there been more prestigious military decorations awarded among the nations engaged in combat during the Afghanistan War?,0.0
WNBA's Brittney Griner arrested in Russia on drug charges,0.0
"Ghislane Maxwell, long-time friend and confidante of Jeffrey Epstein, has been arrested by the FBI and charged by federal prosecutors",0.0
Malaysia detains 60 Chinese nationals and 6 vessels for trespassing,1.0
RESOLVED: Japan Is Ready to Become a Formal Member of Five Eyes,1.0
Republican AG Told ‘At Least the Guy Was a Democrat’ After He Killed a Man With His Car,0.0
Democrats Introduce Resolution to Permanently Ban Trump from Stepping Foot on U.S. Capitol Grounds,0.0
WVirginia teen to be tried as adult in killing of his family,0.0
"Trump to face ‘subpoenas and seizures’ following presidency, ex-Manhattan prosecutor says",1.0
"Race, Culture & Status in Geopolitics",1.0
"Louisiana police officer was fired over a Facebook comment that said it was ""unfortunate"" more black people did not die of the coronavirus.",0.0
China’s Techno-Authoritarianism Has Gone Global: Washington Needs to Offer an Alternative,1.0
"Biden to announce requirement for employers with more than 100 employees to mandate vaccines, impacting over 80 million workers",1.0
Jordan warns Israel of 'massive conflict' over annexation,0.0
Illinois becomes first state to ban police from lying to minors during interrogations,0.0
Biden Team Weighs Venezuela Oil Sales as U.S. Nears Russia Ban,0.0
"‘In the middle of a pandemic, they’re selling beans’: Chris Cuomo blasts Trump for hawking Goya",1.0
Trump has concealed details of his face-to-face encounters with Putin from senior officials in administration,1.0
Russia Invasion of Ukraine Live Thread,1.0
The 'United Nations of cat federations' bans Russian cats from its competitions.,1.0
"Mitt Romney Points Out GOP Wasn't Concerned About Debt, 'Spending Massively' Under Trump",1.0
"Warren, Pressley introduce bill to make it a crime for police officers to deny medical care to people in custody",0.0
Putin's Gamble: Why a cold front in Europe could determine the fate of Ukraine and international norms,1.0
Opinion | Trump reminds us why electing him in 2024 would be a disaster,0.0
A homeless man rescued all the animals at a shelter after it caught on fire,1.0
TV: Israeli officials warn ‘no choice’ but to ready attack plans after Raisi win,1.0
A Chinese Cheating Ring at UCLA Reveals an Industry Devoted to Helping International Students Scam Grades,0.0
"East Mediterranean Gas Location, Pipelines and overlapping claims",1.0
"China state-backed hackers compromised networks of at least 6 U.S. state governments, research finds",1.0
Fact Sheet: New Data Show Progress on Biden-Harris Commitment to Equity in Emergency Small Business Relief,1.0
Sarah Palin went out to eat at a NYC restaurant two days after testing positive for Covid,1.0
The GOP wants you to think of Joe Biden when you fill your tank,1.0
"Florida lawmakers agree to 1-month gas tax break, right before governor’s election",1.0
Nearly 60% of Americans want Donald Trump barred from holding public office again: Poll,1.0
"Hochul, Cuomo neck and neck in hypothetical governor primary: poll",1.0
/r/Politics now has user-selectable flair representing Indigenous Nations.,1.0
Dozens subpoenaed in intensifying Rensselaer County ballot fraud investigation,0.0
Trump calls mail-in ballots 'dishonest' but says absentee ballots are 'fine.' They're the same thing.,0.0
U.S. ban on Russian energy imports does not include uranium -source,0.0
"Pak-Saudi ties: indispensability, interdependence and pragmatism | Saudi Arabia is pivotal to Pakistan in a world where Pakistan badly needs more friends",1.0
"“America First” Means a Retreat From Foreign Conflicts: In a Muted UN Speech, Trump Commits to Pulling Back",0.0
U.S. sanctions China's paramilitary in Xinjiang,1.0
Can someone please explain the difference between irredentism and revanchism?,1.0
Bernie Sanders reminds Americans tipped minimum wage has remained $2.13 an hour for 30 years,1.0
$1.5 Trillion Bill includes 21% raises for House Staffers,1.0
Afghans mark Soviet withdrawal as US negotiates its own exit,1.0
State Department Lawyers Concluded Insufficient Evidence to Prove Genocide in China,1.0
"'My God,' Says US Senator After William Barr Deploys 'History Is Written by the Winners' Trope | ""The head of the American justice system now saying publicly that there is no good or bad except what the strongest want. The definition of autocracy.""",1.0
Disney heir criticises company over $1.5bn bonuses as it cuts pay,0.0
US weekly jobless claims double to 6.6 million,1.0
'Kentucky Can Do Better Than Mitch McConnell': Democrat Amy McGrath Endorsed by One of Kentucky's Largest Newspapers,1.0
S.Korea's Moon orders protection of nuclear power plant amid wildfire,1.0
Pelosi wants ‘unhinged’ Trump to be stripped of nuclear codes,1.0
Sen. Kelly Loeffler Dumped Millions in Stock After Coronavirus Briefing,0.0
Marjorie Taylor Greene owns stock in 3 vaccine manufacturers,1.0
NYT: Israel likely behind incident at Iranian Nuclear site,1.0
"Hackers breach Electronic Arts, stealing game source code and tools",0.0
Mark Meadows Spread Trump’s Voter Fraud Claims. Now His Voting Record Is Under Scrutiny.,0.0
"Egypt, Ethiopia and Sudan agree to halt filling of Nile dam until binding deal is reached",1.0
"President-elect Joe Biden clears 270-vote threshold in Electoral College count, formalizing his victory",1.0
Recommendations for reliable sources to track on-ground events/news about the Ukraine situation,1.0
"How likely are there conspirators in Afghanistan against the Taliban, and is Afghanistan too tribal and remote for unity under a different government?",1.0
Best Way to Learn about Geopolitics,1.0
Russia was once enemy number one in the US. So how did Vladimir Putin infiltrate the Republican Party?,0.0
"The Emerging Biden Doctrine: Democracy, Autocracy, and the Defining Clash of Our Time",1.0
"Biden's lead in Georgia grows to over 14,000 votes",1.0
Admitted KKK leader who drove through crowd of protesters found guilty on multiple charges,0.0
Ethiopia says set to begin filling disputed dam in 2 weeks,0.0
George Floyd's family says four officers involved in his death should be charged with murder,0.0
New York Times reporter infected with Covid-19 says the White House is not doing contact tracing,0.0
The EU Dropped Plans To Release A Statement Backing Canada In Its Diplomatic Fight With Saudi Arabia,0.0
Russia rejects ‘unacceptable’ US conditions to extend nuclear arms treaty,0.0
Elon Musk suggests that anyone over the age of 70 should be barred from running for political office,1.0
Colorado governor stands by saying 'you're a selfish bastard' if you refuse to wear a mask,0.0
Endurance is Found,1.0
What is going on with Syria (2021 update) ?,1.0
The Lions legacy,1.0
Pence to Say 'No Room' in GOP for Putin Apologists After Trump Genius Claim,0.0
Texas man guilty for role in assault on U.S. Capitol in landmark win for prosecutors,0.0
Active shooter at Mandalay Bay Casino in Las Vegas,1.0
Tacoma woman sentenced for burning 5 police cars during 2020 Seattle protests,0.0
Iran's Zarif criticizes Revolutionary Guards' influence in leaked tape,0.0
Jan. 6 House Panel Reportedly Finding Trump White House Visitor Logs 'Very Fruitful',1.0
Leaked: Trump - Duterte phone call transcript,0.0
Education Secretary Betsy DeVos Resigns,0.0
"It'll be 'very difficult' to get detained US basketball star Brittney Griner out of Russia, lawmaker says",0.0
Ben Wallace announces UK govt will send more weapons to Ukraine for country to defend itself against Russia,0.0
"On Somaliland's recognition, perspective from a citizen of Somaliland.",1.0
Fact check: Congress expelled 14 members in 1861 for supporting the Confederacy,1.0
Biden revokes presidential permit for Keystone XL pipeline expansion on 1st day,1.0
"Gaize, Inc. closes $1.2 million USD seed financing for their non-invasive cannabis impairment detection device",1.0
Question: With the government of Ethiopia seeming more pressured every day and with the Tigray rebel army advancing any indications of what will happen regarding the future of Egypt and the Grand Renaissance Dam?,1.0
Bill Gates says we can’t restart the economy soon and simply “ignore that pile of bodies over in the corner”,1.0
U.S. nuclear weapons agency breached as part of extensive espionage operation,0.0
The Former Danish minister of defense Claus Hjort is charged for leaking state secrets,0.0
"The 2020 census had big undercounts of Black people, Latinos and Native Americans",1.0
"Texan files $1 billion class-action lawsuit after receiving $9,000 electric bill",0.0
Sanders: 'I never expected in my life as an American to see a swastika at a major political rally',1.0
"US, Australia, India, Japan discuss China's growing power",1.0
Key inflation measure jumps to highest level since January 1982,1.0
Newly discovered rainbow-colored fish lives in the ocean's 'twilight zone',1.0
[2021-10-02] Geopolitics Weekly Discussion Thread,1.0
First Field Office Interview,1.0
Saudi Arabia says cracking down on illegal Captagon drug,0.0
Megathread: Long-Concealed Records Show President Trump’s Losses and Years of Tax Avoidance,0.0
Full list of 17 lawmakers who voted against Russian oil ban,0.0
[Megathread] NY Attorney General Moves to Dissolve the NRA After Fraud Investigation,0.0
Photo emerges of Republican barricading chamber doors during US Capitol attack after he compared rioters to ‘tourists’,0.0
News Analysis: Ukraine crisis gives Kamala Harris a new role,0.0
Russia moves more troops westward amid Ukraine tensions,0.0
See prominent Russian dissident's reaction to Republicans calling Democrats 'communist',1.0
Joe Biden's Approval Rating Fails to Rise Among Independents After State of the Union—Poll,1.0
"Mississippi Election Commissioner Complains That ""Blacks"" Are Registering to Vote",0.0
"Iraqi national TV announces assassination of Qassem Suleimani, head of Iran’s Quds Force",0.0
FBI: No evidence antifa involved in Capitol riot,0.0
A Republican congressman who denied there was an insurrection and likened Capitol rioters to 'tourists' was photographed barricading the chamber doors against them,0.0
Schumer: Senate will act on marijuana legalization with or without Biden,1.0
Third Sandy Hook parent wins defamation suit against Alex Jones,1.0
House Jan. 6 panel alleges Trump engaged in 'criminal conspiracy',0.0
Pay rises fail to keep up with the cost of living,0.0
Zelenskyy 'survives three assassination attempts in past week',0.0
"Amazon hired an army of employees to say nice things about it on Twitter, and it shows how big its reputation problem has gotten",1.0
Harris’ trip to Poland and Romania turns fraught after US rejects Polish plan to get jets to Ukraine,0.0
Washington Is Preparing for the Wrong War With China,0.0
The Dutch and Canadians being in charge of brigade-sized formations in southern Afghanistan back in 2006,1.0
NYC to terminate Trump contracts after Capitol insurrection,1.0
Belarus Turned Off the Internet. Its Citizens Hot-Wired It.,1.0
1 of 2 protesters hit by car on closed Seattle highway dies,0.0
School lunch waivers to deal with supply chain crunch are at risk in spending bill,0.0
China a ‘welcome friend’ for reconstruction in Afghanistan: Taliban spokesman,1.0
"Russia does not fear a US Military invasion, it fears liberalization",0.0
Texas judge to rule on probes of transgender kids' parents,1.0
Trump news today: Former president suggests ‘bombing the s*** out of Russia’ with US jets disguised in Chinese flag,0.0
